{
  "spec_version": 1,
  "entity_name": "Otyugh",
  "entity_slug": "otyugh",
  "entity_type": "monster",
  "canvas_profile": "128x128",
  "dnd_size": "Large",
  "creature_type": "Aberration",
  "cr": "5",
  "outline_family": "OUTLINE-VIOLET",
  "material_assignments": {
    "body": "SKIN-COOL",
    "eyes": "MAGIC-VIOLET"
  },
  "frames": [
    {
      "frame": "idle",
      "filename": "otyugh_idle.png",
      "pose_hint": "Standing alert in a neutral ready stance, weight balanced."
    },
    {
      "frame": "attack",
      "filename": "otyugh_attack.png",
      "pose_hint": "Mid-strike with primary attack, body lunging forward."
    },
    {
      "frame": "death",
      "filename": "otyugh_death.png",
      "pose_hint": "Collapsing or fallen, body limp and defeated.",
      "material_overrides": {
        "blood": "BLOOD"
      }
    }
  ],
  "visual_descriptors": [
    "large aberration",
    "fangs/bite"
  ],
  "typical_equipment": null,
  "generation_notes": "Large aberration. fangs/bite."
}
