{
  "spec_version": 1,
  "entity_name": "Ancient Black Dragon",
  "entity_slug": "ancient_black_dragon",
  "entity_type": "monster",
  "canvas_profile": "192x192",
  "dnd_size": "Gargantuan",
  "creature_type": "Dragon (Chromatic)",
  "cr": "21",
  "outline_family": "OUTLINE-WARM",
  "material_assignments": {
    "body": "CLOTH-OLIVE",
    "accent": "WARM-GOLD",
    "eyes": "WARM-GOLD",
    "wings": "CLOTH-OLIVE"
  },
  "frames": [
    {
      "frame": "idle",
      "filename": "ancient_black_dragon_idle.png",
      "pose_hint": "Standing alert in a neutral ready stance, weight balanced."
    },
    {
      "frame": "attack",
      "filename": "ancient_black_dragon_attack.png",
      "pose_hint": "Mid-strike with primary attack, body lunging forward."
    },
    {
      "frame": "death",
      "filename": "ancient_black_dragon_death.png",
      "pose_hint": "Collapsing or fallen, body limp and defeated.",
      "material_overrides": {
        "blood": "BLOOD"
      }
    }
  ],
  "visual_descriptors": [
    "gargantuan dragon (chromatic)",
    "black scales",
    "wings",
    "claws",
    "tail"
  ],
  "typical_equipment": null,
  "generation_notes": "Gargantuan dragon. black scales, wings, claws, tail. Dominant black coloration throughout scales and wings. Massive, weathered, ancient and imposing."
}
