{
  "spec_version": 1,
  "entity_name": "Marilith",
  "entity_slug": "marilith",
  "entity_type": "monster",
  "canvas_profile": "128x128",
  "dnd_size": "Large",
  "creature_type": "Fiend (Demon)",
  "cr": "16",
  "outline_family": "OUTLINE-WARM",
  "material_assignments": {
    "body": "SKIN-DARK",
    "accent": "FIRE",
    "eyes": "FIRE"
  },
  "frames": [
    {
      "frame": "idle",
      "filename": "marilith_idle.png",
      "pose_hint": "Standing alert in a neutral ready stance, weight balanced."
    },
    {
      "frame": "attack",
      "filename": "marilith_attack.png",
      "pose_hint": "Mid-strike with primary attack, body lunging forward."
    },
    {
      "frame": "death",
      "filename": "marilith_death.png",
      "pose_hint": "Collapsing or fallen, body limp and defeated.",
      "material_overrides": {
        "blood": "BLOOD"
      }
    }
  ],
  "visual_descriptors": [
    "large fiend (demon)",
    "fiendish"
  ],
  "typical_equipment": null,
  "generation_notes": "Large fiend. fiendish."
}
