{
  "spec_version": 1,
  "entity_name": "Fungi",
  "entity_slug": "fungi",
  "entity_type": "monster",
  "canvas_profile": "64x64",
  "dnd_size": "Medium",
  "creature_type": "Plant",
  "cr": "0",
  "outline_family": "OUTLINE-WARM",
  "material_assignments": {
    "body": "CLOTH-GREEN"
  },
  "frames": [
    {
      "frame": "idle",
      "filename": "fungi_idle.png",
      "pose_hint": "Standing alert in a neutral ready stance, weight balanced."
    },
    {
      "frame": "attack",
      "filename": "fungi_attack.png",
      "pose_hint": "Mid-strike with primary attack, body lunging forward."
    },
    {
      "frame": "death",
      "filename": "fungi_death.png",
      "pose_hint": "Collapsing or fallen, body limp and defeated."
    }
  ],
  "visual_descriptors": [
    "medium plant",
    "plant body"
  ],
  "typical_equipment": null,
  "generation_notes": "Medium plant. plant body."
}
