{
  "spec_version": 1,
  "entity_name": "Ogre",
  "entity_slug": "ogre",
  "entity_type": "monster",
  "canvas_profile": "128x128",
  "dnd_size": "Large",
  "creature_type": "Giant",
  "cr": "2",
  "outline_family": "OUTLINE-WARM",
  "material_assignments": {
    "body": "SKIN-MEDIUM",
    "weapon": "WOOD"
  },
  "frames": [
    {
      "frame": "idle",
      "filename": "ogre_idle.png",
      "pose_hint": "Standing alert in a neutral ready stance, weight balanced."
    },
    {
      "frame": "attack",
      "filename": "ogre_attack.png",
      "pose_hint": "Mid-strike with primary attack, body lunging forward."
    },
    {
      "frame": "death",
      "filename": "ogre_death.png",
      "pose_hint": "Collapsing or fallen, body limp and defeated.",
      "material_overrides": {
        "blood": "BLOOD"
      }
    }
  ],
  "visual_descriptors": [
    "large giant"
  ],
  "typical_equipment": [
    "javelin"
  ],
  "generation_notes": "Large giant."
}
