{
  "spec_version": 1,
  "entity_name": "Young Gold Dragon",
  "entity_slug": "young_gold_dragon",
  "entity_type": "monster",
  "canvas_profile": "128x128",
  "dnd_size": "Large",
  "creature_type": "Dragon (Metallic)",
  "cr": "10",
  "outline_family": "OUTLINE-WARM",
  "material_assignments": {
    "body": "WARM-GOLD",
    "eyes": "WARM-GOLD",
    "wings": "WARM-GOLD"
  },
  "frames": [
    {
      "frame": "idle",
      "filename": "young_gold_dragon_idle.png",
      "pose_hint": "Standing alert in a neutral ready stance, weight balanced."
    },
    {
      "frame": "attack",
      "filename": "young_gold_dragon_attack.png",
      "pose_hint": "Mid-strike with primary attack, body lunging forward."
    },
    {
      "frame": "death",
      "filename": "young_gold_dragon_death.png",
      "pose_hint": "Collapsing or fallen, body limp and defeated.",
      "material_overrides": {
        "blood": "BLOOD"
      }
    }
  ],
  "visual_descriptors": [
    "large dragon (metallic)",
    "gold scales",
    "wings",
    "claws",
    "tail"
  ],
  "typical_equipment": null,
  "generation_notes": "Large dragon. gold scales, wings, claws, tail. Dominant gold coloration throughout scales and wings. Moderate size, developing features."
}
