{
  "spec_version": 1,
  "entity_name": "Bandit Captain",
  "entity_slug": "bandit_captain",
  "entity_type": "monster",
  "canvas_profile": "64x64",
  "dnd_size": "Medium",
  "creature_type": "Humanoid",
  "cr": "2",
  "outline_family": "OUTLINE-WARM",
  "material_assignments": {
    "body": "SKIN-MEDIUM",
    "armor": "LEATHER-BROWN",
    "weapon": "METAL-IRON",
    "accent": "CLOTH-RED"
  },
  "frames": [
    {
      "frame": "idle",
      "filename": "bandit_captain_idle.png",
      "pose_hint": "Standing alert in a neutral ready stance, weight balanced."
    },
    {
      "frame": "attack",
      "filename": "bandit_captain_attack.png",
      "pose_hint": "Mid-strike with primary attack, body lunging forward."
    },
    {
      "frame": "death",
      "filename": "bandit_captain_death.png",
      "pose_hint": "Collapsing or fallen, body limp and defeated.",
      "material_overrides": {
        "blood": "BLOOD"
      }
    }
  ],
  "visual_descriptors": [
    "medium humanoid",
    "humanoid",
    "tail"
  ],
  "typical_equipment": [
    "leather armor",
    "scimitar"
  ],
  "generation_notes": "Medium humanoid. humanoid, tail."
}
