{
  "spec_version": 1,
  "entity_name": "Stone Golem",
  "entity_slug": "stone_golem",
  "entity_type": "monster",
  "canvas_profile": "128x128",
  "dnd_size": "Large",
  "creature_type": "Construct",
  "cr": "1/8",
  "outline_family": "OUTLINE-WARM",
  "material_assignments": {
    "body": "NEUTRAL-COOL",
    "eyes": "MAGIC-BLUE"
  },
  "frames": [
    {
      "frame": "idle",
      "filename": "stone_golem_idle.png",
      "pose_hint": "Standing alert in a neutral ready stance, weight balanced."
    },
    {
      "frame": "attack",
      "filename": "stone_golem_attack.png",
      "pose_hint": "Mid-strike with primary attack, body lunging forward."
    },
    {
      "frame": "death",
      "filename": "stone_golem_death.png",
      "pose_hint": "Collapsing or fallen, body limp and defeated."
    }
  ],
  "visual_descriptors": [
    "large construct",
    "constructed body"
  ],
  "typical_equipment": null,
  "generation_notes": "Large construct. constructed body."
}
