{
  "spec_version": 1,
  "entity_name": "Ettercap",
  "entity_slug": "ettercap",
  "entity_type": "monster",
  "canvas_profile": "64x64",
  "dnd_size": "Medium",
  "creature_type": "Monstrosity",
  "cr": "2",
  "outline_family": "OUTLINE-WARM",
  "material_assignments": {
    "body": "SKIN-MEDIUM"
  },
  "frames": [
    {
      "frame": "idle",
      "filename": "ettercap_idle.png",
      "pose_hint": "Standing alert in a neutral ready stance, weight balanced."
    },
    {
      "frame": "attack",
      "filename": "ettercap_attack.png",
      "pose_hint": "Mid-strike with primary attack, body lunging forward."
    },
    {
      "frame": "death",
      "filename": "ettercap_death.png",
      "pose_hint": "Collapsing or fallen, body limp and defeated.",
      "material_overrides": {
        "blood": "BLOOD"
      }
    }
  ],
  "visual_descriptors": [
    "medium monstrosity",
    "fangs/bite",
    "claws"
  ],
  "typical_equipment": null,
  "generation_notes": "Medium monstrosity. fangs/bite, claws."
}
