{
  "spec_version": 1,
  "entity_name": "Kraken",
  "entity_slug": "kraken",
  "entity_type": "monster",
  "canvas_profile": "192x192",
  "dnd_size": "Gargantuan",
  "creature_type": "Monstrosity (Titan)",
  "cr": "23",
  "outline_family": "OUTLINE-WARM",
  "material_assignments": {
    "body": "SKIN-MEDIUM"
  },
  "frames": [
    {
      "frame": "idle",
      "filename": "kraken_idle.png",
      "pose_hint": "Standing alert in a neutral ready stance, weight balanced."
    },
    {
      "frame": "attack",
      "filename": "kraken_attack.png",
      "pose_hint": "Mid-strike with primary attack, body lunging forward."
    },
    {
      "frame": "death",
      "filename": "kraken_death.png",
      "pose_hint": "Collapsing or fallen, body limp and defeated.",
      "material_overrides": {
        "blood": "BLOOD"
      }
    }
  ],
  "visual_descriptors": [
    "gargantuan monstrosity (titan)"
  ],
  "typical_equipment": null,
  "generation_notes": "Gargantuan monstrosity."
}
