{
  "spec_version": 1,
  "entity_name": "Animals",
  "entity_slug": "animals",
  "entity_type": "monster",
  "canvas_profile": "128x128",
  "dnd_size": "Large",
  "creature_type": "Beast (Dinosaur)",
  "cr": "3",
  "outline_family": "OUTLINE-WARM",
  "material_assignments": {
    "body": "LEATHER-BROWN"
  },
  "frames": [
    {
      "frame": "idle",
      "filename": "animals_idle.png",
      "pose_hint": "Standing alert in a neutral ready stance, weight balanced."
    },
    {
      "frame": "attack",
      "filename": "animals_attack.png",
      "pose_hint": "Mid-strike with primary attack, body lunging forward."
    },
    {
      "frame": "death",
      "filename": "animals_death.png",
      "pose_hint": "Collapsing or fallen, body limp and defeated.",
      "material_overrides": {
        "blood": "BLOOD"
      }
    }
  ],
  "visual_descriptors": [
    "large beast (dinosaur)",
    "tail"
  ],
  "typical_equipment": null,
  "generation_notes": "Large beast. tail."
}
