{
  "spec_version": 1,
  "entity_name": "Fire Elemental",
  "entity_slug": "fire_elemental",
  "entity_type": "monster",
  "canvas_profile": "128x128",
  "dnd_size": "Large",
  "creature_type": "Elemental",
  "cr": "5",
  "outline_family": "OUTLINE-WARM",
  "material_assignments": {
    "body": "FIRE"
  },
  "frames": [
    {
      "frame": "idle",
      "filename": "fire_elemental_idle.png",
      "pose_hint": "Standing alert in a neutral ready stance, weight balanced."
    },
    {
      "frame": "attack",
      "filename": "fire_elemental_attack.png",
      "pose_hint": "Mid-strike with primary attack, body lunging forward."
    },
    {
      "frame": "death",
      "filename": "fire_elemental_death.png",
      "pose_hint": "Collapsing or fallen, body limp and defeated."
    }
  ],
  "visual_descriptors": [
    "large elemental",
    "elemental form"
  ],
  "typical_equipment": null,
  "generation_notes": "Large elemental. elemental form. Body composed entirely of fire."
}
