{
  "spec_version": 1,
  "entity_name": "Will-o’-Wisp",
  "entity_slug": "will_o_wisp",
  "entity_type": "monster",
  "canvas_profile": "64x64",
  "dnd_size": "Tiny",
  "creature_type": "Undead",
  "cr": "2",
  "outline_family": "OUTLINE-COOL",
  "material_assignments": {
    "body": "BONE",
    "eyes": "FIRE"
  },
  "frames": [
    {
      "frame": "idle",
      "filename": "will_o_wisp_idle.png",
      "pose_hint": "Standing alert in a neutral ready stance, weight balanced."
    },
    {
      "frame": "attack",
      "filename": "will_o_wisp_attack.png",
      "pose_hint": "Mid-strike with primary attack, body lunging forward."
    },
    {
      "frame": "death",
      "filename": "will_o_wisp_death.png",
      "pose_hint": "Collapsing or fallen, body limp and defeated.",
      "material_overrides": {
        "blood": "BLOOD"
      }
    }
  ],
  "visual_descriptors": [
    "tiny undead",
    "undead",
    "fangs/bite"
  ],
  "typical_equipment": null,
  "generation_notes": "Tiny undead. undead, fangs/bite."
}
