{
  "spec_version": 1,
  "entity_name": "Knight",
  "entity_slug": "knight",
  "entity_type": "monster",
  "canvas_profile": "64x64",
  "dnd_size": "Medium",
  "creature_type": "Humanoid",
  "cr": "3",
  "outline_family": "OUTLINE-WARM",
  "material_assignments": {
    "body": "SKIN-MEDIUM",
    "weapon": "WOOD",
    "armor": "METAL-IRON",
    "accent": "CLOTH-RED"
  },
  "frames": [
    {
      "frame": "idle",
      "filename": "knight_idle.png",
      "pose_hint": "Standing alert in a neutral ready stance, weight balanced."
    },
    {
      "frame": "attack",
      "filename": "knight_attack.png",
      "pose_hint": "Mid-strike with primary attack, body lunging forward."
    },
    {
      "frame": "death",
      "filename": "knight_death.png",
      "pose_hint": "Collapsing or fallen, body limp and defeated.",
      "material_overrides": {
        "blood": "BLOOD"
      }
    }
  ],
  "visual_descriptors": [
    "medium humanoid",
    "humanoid"
  ],
  "typical_equipment": [
    "crossbow",
    "greatsword",
    "longsword",
    "plate armor"
  ],
  "generation_notes": "Medium humanoid. humanoid."
}
