{
  "spec_version": 1,
  "entity_name": "Spider",
  "entity_slug": "spider",
  "entity_type": "monster",
  "canvas_profile": "64x64",
  "dnd_size": "Tiny",
  "creature_type": "Beast",
  "cr": "0",
  "outline_family": "OUTLINE-WARM",
  "material_assignments": {
    "body": "LEATHER-BROWN"
  },
  "frames": [
    {
      "frame": "idle",
      "filename": "spider_idle.png",
      "pose_hint": "Standing alert in a neutral ready stance, weight balanced."
    },
    {
      "frame": "attack",
      "filename": "spider_attack.png",
      "pose_hint": "Mid-strike with primary attack, body lunging forward."
    },
    {
      "frame": "death",
      "filename": "spider_death.png",
      "pose_hint": "Collapsing or fallen, body limp and defeated.",
      "material_overrides": {
        "blood": "BLOOD"
      }
    }
  ],
  "visual_descriptors": [
    "tiny beast",
    "eight legs",
    "fangs/bite"
  ],
  "typical_equipment": null,
  "generation_notes": "Tiny beast. eight legs, fangs/bite."
}
