{
  "spec_version": 1,
  "entity_name": "Polar Bear",
  "entity_slug": "polar_bear",
  "entity_type": "monster",
  "canvas_profile": "128x128",
  "dnd_size": "Large",
  "creature_type": "Beast",
  "cr": "2",
  "outline_family": "OUTLINE-WARM",
  "material_assignments": {
    "body": "LEATHER-BROWN"
  },
  "frames": [
    {
      "frame": "idle",
      "filename": "polar_bear_idle.png",
      "pose_hint": "Standing alert in a neutral ready stance, weight balanced."
    },
    {
      "frame": "attack",
      "filename": "polar_bear_attack.png",
      "pose_hint": "Mid-strike with primary attack, body lunging forward."
    },
    {
      "frame": "death",
      "filename": "polar_bear_death.png",
      "pose_hint": "Collapsing or fallen, body limp and defeated.",
      "material_overrides": {
        "blood": "BLOOD"
      }
    }
  ],
  "visual_descriptors": [
    "large beast",
    "quadruped",
    "fur",
    "fangs/bite"
  ],
  "typical_equipment": null,
  "generation_notes": "Large beast. quadruped, fur, fangs/bite."
}
