{
  "spec_version": 1,
  "entity_name": "Pseudodragon",
  "entity_slug": "pseudodragon",
  "entity_type": "monster",
  "canvas_profile": "64x64",
  "dnd_size": "Tiny",
  "creature_type": "Dragon",
  "cr": "1/4",
  "outline_family": "OUTLINE-WARM",
  "material_assignments": {
    "body": "CLOTH-GREEN",
    "weapon": "METAL-IRON",
    "accent": "WARM-GOLD",
    "eyes": "WARM-GOLD",
    "wings": "CLOTH-GREEN"
  },
  "frames": [
    {
      "frame": "idle",
      "filename": "pseudodragon_idle.png",
      "pose_hint": "Standing alert in a neutral ready stance, weight balanced."
    },
    {
      "frame": "attack",
      "filename": "pseudodragon_attack.png",
      "pose_hint": "Mid-strike with primary attack, body lunging forward."
    },
    {
      "frame": "death",
      "filename": "pseudodragon_death.png",
      "pose_hint": "Collapsing or fallen, body limp and defeated.",
      "material_overrides": {
        "blood": "BLOOD"
      }
    }
  ],
  "visual_descriptors": [
    "tiny dragon",
    "wings",
    "claws",
    "tail"
  ],
  "typical_equipment": [
    "mace"
  ],
  "generation_notes": "Tiny dragon. wings, claws, tail."
}
