{
  "spec_version": 1,
  "entity_name": "Air Elemental",
  "entity_slug": "air_elemental",
  "entity_type": "monster",
  "canvas_profile": "128x128",
  "dnd_size": "Large",
  "creature_type": "Elemental",
  "cr": "5",
  "outline_family": "OUTLINE-WARM",
  "material_assignments": {
    "body": "NEUTRAL-COOL",
    "weapon": "METAL-IRON"
  },
  "frames": [
    {
      "frame": "idle",
      "filename": "air_elemental_idle.png",
      "pose_hint": "Standing alert in a neutral ready stance, weight balanced."
    },
    {
      "frame": "attack",
      "filename": "air_elemental_attack.png",
      "pose_hint": "Mid-strike with primary attack, body lunging forward."
    },
    {
      "frame": "death",
      "filename": "air_elemental_death.png",
      "pose_hint": "Collapsing or fallen, body limp and defeated."
    }
  ],
  "visual_descriptors": [
    "large elemental",
    "elemental form"
  ],
  "typical_equipment": [
    "longsword"
  ],
  "generation_notes": "Large elemental. elemental form. Body composed entirely of air."
}
