{
  "spec_version": 1,
  "entity_name": "Giant Ape",
  "entity_slug": "giant_ape",
  "entity_type": "monster",
  "canvas_profile": "192x192",
  "dnd_size": "Huge",
  "creature_type": "Beast",
  "cr": "7",
  "outline_family": "OUTLINE-WARM",
  "material_assignments": {
    "body": "LEATHER-BROWN"
  },
  "frames": [
    {
      "frame": "idle",
      "filename": "giant_ape_idle.png",
      "pose_hint": "Standing alert in a neutral ready stance, weight balanced."
    },
    {
      "frame": "attack",
      "filename": "giant_ape_attack.png",
      "pose_hint": "Mid-strike with primary attack, body lunging forward."
    },
    {
      "frame": "death",
      "filename": "giant_ape_death.png",
      "pose_hint": "Collapsing or fallen, body limp and defeated.",
      "material_overrides": {
        "blood": "BLOOD"
      }
    }
  ],
  "visual_descriptors": [
    "huge beast",
    "massive frame"
  ],
  "typical_equipment": null,
  "generation_notes": "Huge beast. massive frame."
}
